{
  "queue_id": "queue-synthetic-self-growth",
  "generated_at": "2026-06-11",
  "mode": "report_only",
  "mutation_performed": false,
  "source_refs": [
    "scorecard-synthetic-core",
    "branch-synthetic-oss-maintainer",
    "docs/downstream-dogfooding.md"
  ],
  "ideas": [
    {
      "idea_id": "idea-growth-queue-cli",
      "title": "Rank public-safe self-growth ideas",
      "summary": "Give maintainers a deterministic queue for choosing the next MONOLITH Core improvement without importing private adapter data.",
      "source_refs": [
        "scorecard-synthetic-core",
        "docs/downstream-dogfooding.md"
      ],
      "status": "adopted",
      "public_safety": "synthetic",
      "impact": 5,
      "effort": 2,
      "confidence": 4,
      "next_action": "Keep using growth-queue to choose the next public-safe MONOLITH Core improvement."
    },
    {
      "idea_id": "idea-repair-plan-report",
      "title": "Generate repair plans from validation failures",
      "summary": "Turn validation or scorecard failures into a public-safe report-only repair plan for the next small PR.",
      "source_refs": [
        "scorecard-synthetic-core",
        "finding-context-recovery"
      ],
      "status": "adopted",
      "public_safety": "generalized",
      "impact": 5,
      "effort": 3,
      "confidence": 4,
      "next_action": "Use repair-plan reports before promoting public fixture or schema fixes."
    },
    {
      "idea_id": "idea-synthetic-adapter-example",
      "title": "Add synthetic adapter conversion example",
      "summary": "Show how a Markdown-like note can become the public JSON card, index, and context-pack contracts without real vault data.",
      "source_refs": [
        "docs/obsidian-workflow.md",
        "docs/adapter-boundary.md"
      ],
      "status": "adopted",
      "public_safety": "synthetic",
      "impact": 4,
      "effort": 3,
      "confidence": 4,
      "next_action": "Keep adapter conversion examples synthetic and report-only."
    },
    {
      "idea_id": "idea-context-pack-diff-report",
      "title": "Add context-pack diff report",
      "summary": "Compare two public context-pack fixtures and report added, removed, and unchanged card ids without mutating either pack.",
      "source_refs": [
        "context-pack.json",
        "docs/memory-scorecard.md"
      ],
      "status": "adopted",
      "public_safety": "synthetic",
      "impact": 4,
      "effort": 3,
      "confidence": 4,
      "next_action": "Use context-pack-diff before promoting context-pack changes."
    },
    {
      "idea_id": "idea-validation-summary-report",
      "title": "Add validation summary report",
      "summary": "Render a compact public validation summary that groups counts, blockers, and next actions for maintainers.",
      "source_refs": [
        "validate",
        "docs/repair-plan.md"
      ],
      "status": "adopted",
      "public_safety": "generalized",
      "impact": 4,
      "effort": 3,
      "confidence": 4,
      "next_action": "Use validation-summary before promoting validation reports."
    },
    {
      "idea_id": "idea-release-readiness-report",
      "title": "Add release readiness report",
      "summary": "Combine validation summary, scorecard, growth queue, and context-pack diff signals into a compact public release readiness report.",
      "source_refs": [
        "docs/validation-summary.md",
        "docs/context-pack-diff.md"
      ],
      "status": "adopted",
      "public_safety": "generalized",
      "impact": 4,
      "effort": 3,
      "confidence": 4,
      "next_action": "Use release-readiness before publishing public releases."
    },
    {
      "idea_id": "idea-adapter-boundary-readiness-checklist",
      "title": "Add adapter boundary readiness checklist",
      "summary": "Make v0.3 adapter-boundary work visible with public-safe checks for local implementation, operational use, and downstream returns without private data.",
      "source_refs": [
        "docs/adapter-boundary.md",
        "docs/downstream-dogfooding.md",
        "docs/release-readiness.md"
      ],
      "status": "candidate",
      "public_safety": "generalized",
      "impact": 4,
      "effort": 3,
      "confidence": 4,
      "next_action": "Add a v0.3 adapter boundary readiness checklist and docs."
    },
    {
      "idea_id": "idea-downstream-dogfooding-docs",
      "title": "Document downstream dogfooding",
      "summary": "Explain how private adapter findings become public-safe issues, fixtures, and docs.",
      "source_refs": [
        "docs/downstream-dogfooding.md"
      ],
      "status": "adopted",
      "public_safety": "generalized",
      "impact": 4,
      "effort": 2,
      "confidence": 5,
      "next_action": "Keep using the guide when returning private adapter lessons to public MONOLITH Core."
    }
  ]
}
